[
  {
    "id": "monster-weak-melee",
    "name": "Weak Melee",
    "description": "A clumsy melee swing used by trash mobs.",
    "icon": "skills/monster/weak-melee.png",
    "trigger": "active",
    "target": "single-enemy",
    "cooldown": 1,
    "minLevel": 1,
    "maxLevel": 1,
    "damage": {
      "min": 10,
      "max": 15,
      "breakdown": {
        "physical": 15
      }
    },
    "damageType": "physical",
    "appliesTags": [
      "physical"
    ]
  },
  {
    "id": "monster-strong-melee",
    "name": "Strong Melee",
    "description": "A powerful melee strike used by elites and bosses.",
    "icon": "skills/monster/strong-melee.png",
    "trigger": "active",
    "target": "single-enemy",
    "cooldown": 1,
    "minLevel": 1,
    "maxLevel": 1,
    "damage": {
      "min": 30,
      "max": 50,
      "breakdown": {
        "physical": 50
      }
    },
    "damageType": "physical",
    "appliesTags": [
      "physical"
    ]
  },
  {
    "id": "monster-fire-breath",
    "name": "Fire Breath",
    "description": "A cone of flame breathed at the party, burning targets.",
    "icon": "skills/monster/fire-breath.png",
    "trigger": "active",
    "target": "area-enemies",
    "cooldown": 3,
    "minLevel": 1,
    "maxLevel": 1,
    "damage": {
      "min": 40,
      "max": 60,
      "breakdown": {
        "fire": 60
      }
    },
    "damageType": "fire",
    "appliesStatus": [
      "burn"
    ],
    "appliesTags": [
      "fire",
      "burn"
    ]
  },
  {
    "id": "monster-poison-spit",
    "name": "Poison Spit",
    "description": "Spits venom at a single target, applying 2 stacks of poison.",
    "icon": "skills/monster/poison-spit.png",
    "trigger": "active",
    "target": "single-enemy",
    "cooldown": 2,
    "minLevel": 1,
    "maxLevel": 1,
    "damage": {
      "min": 20,
      "max": 30,
      "breakdown": {
        "poison": 30
      }
    },
    "damageType": "poison",
    "appliesStatus": [
      "poison"
    ],
    "appliesTags": [
      "poison"
    ]
  },
  {
    "id": "monster-lightning-bolt",
    "name": "Lightning Bolt",
    "description": "Hurls a bolt of lightning at a single target.",
    "icon": "skills/monster/lightning-bolt.png",
    "trigger": "active",
    "target": "single-enemy",
    "cooldown": 2,
    "minLevel": 1,
    "maxLevel": 1,
    "damage": {
      "min": 50,
      "max": 70,
      "breakdown": {
        "lightning": 70
      }
    },
    "damageType": "lightning",
    "appliesStatus": [
      "paralyze"
    ],
    "appliesTags": [
      "lightning",
      "shock"
    ]
  },
  {
    "id": "monster-frost-aura",
    "name": "Frost Aura",
    "description": "An aura of cold that chills all nearby enemies each turn.",
    "icon": "skills/monster/frost-aura.png",
    "trigger": "active",
    "target": "all-enemies",
    "cooldown": 3,
    "minLevel": 1,
    "maxLevel": 1,
    "damage": {
      "min": 15,
      "max": 25,
      "breakdown": {
        "cold": 25
      }
    },
    "damageType": "cold",
    "appliesStatus": [
      "chill"
    ],
    "appliesTags": [
      "cold",
      "chill"
    ]
  },
  {
    "id": "monster-charge",
    "name": "Charge",
    "description": "A boss ability: charges a target for heavy physical damage.",
    "icon": "skills/monster/monster-charge.png",
    "trigger": "active",
    "target": "single-enemy",
    "cooldown": 4,
    "minLevel": 1,
    "maxLevel": 1,
    "damage": {
      "min": 60,
      "max": 90,
      "breakdown": {
        "physical": 90
      }
    },
    "damageType": "physical",
    "appliesTags": [
      "physical"
    ]
  },
  {
    "id": "monster-summon-adds",
    "name": "Summon Minions",
    "description": "Summons 2 trash minions to aid the boss.",
    "icon": "skills/monster/summon-adds.png",
    "trigger": "active",
    "target": "summon",
    "cooldown": 5,
    "minLevel": 1,
    "maxLevel": 1
  },
  {
    "id": "monster-heal",
    "name": "Heal",
    "description": "Restores 30% of the caster's max HP.",
    "icon": "skills/monster/heal.png",
    "trigger": "active",
    "target": "self",
    "cooldown": 4,
    "heal": {
      "min": 30,
      "max": 30,
      "target": "self"
    },
    "minLevel": 1,
    "maxLevel": 1
  },
  {
    "id": "monster-teleport",
    "name": "Teleport",
    "description": "Teleports to a new position, gaining +50% dodge for 1 turn.",
    "icon": "skills/monster/teleport.png",
    "trigger": "active",
    "target": "self",
    "cooldown": 3,
    "minLevel": 1,
    "maxLevel": 1
  },
  {
    "id": "monster-ice-shard",
    "name": "Ice Shard",
    "description": "Hurls a shard of ice at a single target, chilling them.",
    "icon": "skills/monster/ice-shard.png",
    "trigger": "active",
    "target": "single-enemy",
    "cooldown": 2,
    "minLevel": 1,
    "maxLevel": 1,
    "damage": {
      "min": 35,
      "max": 55,
      "breakdown": {
        "cold": 55
      }
    },
    "damageType": "cold",
    "appliesStatus": [
      "chill"
    ],
    "appliesTags": [
      "cold",
      "chill"
    ]
  },
  {
    "id": "monster-inferno",
    "name": "Inferno",
    "description": "Bathes all enemies in fire over time.",
    "icon": "skills/monster/inferno.png",
    "trigger": "active",
    "target": "all-enemies",
    "cooldown": 3,
    "minLevel": 1,
    "maxLevel": 1,
    "damage": {
      "min": 25,
      "max": 40,
      "breakdown": {
        "fire": 40
      }
    },
    "damageType": "fire",
    "appliesStatus": [
      "burn"
    ],
    "appliesTags": [
      "fire",
      "burn"
    ]
  },
  {
    "id": "monster-thunder-storm",
    "name": "Thunder Storm",
    "description": "Calls down lightning bolts on all enemies.",
    "icon": "skills/monster/thunder-storm.png",
    "trigger": "active",
    "target": "all-enemies",
    "cooldown": 4,
    "minLevel": 1,
    "maxLevel": 1,
    "damage": {
      "min": 40,
      "max": 60,
      "breakdown": {
        "lightning": 60
      }
    },
    "damageType": "lightning",
    "appliesStatus": [
      "paralyze"
    ],
    "appliesTags": [
      "lightning",
      "shock"
    ]
  },
  {
    "id": "monster-poison-cloud",
    "name": "Poison Cloud",
    "description": "Releases a cloud of toxic gas that poisons all enemies.",
    "icon": "skills/monster/poison-cloud.png",
    "trigger": "active",
    "target": "all-enemies",
    "cooldown": 3,
    "minLevel": 1,
    "maxLevel": 1,
    "damage": {
      "min": 15,
      "max": 25,
      "breakdown": {
        "poison": 25
      }
    },
    "damageType": "poison",
    "appliesStatus": [
      "poison"
    ],
    "appliesTags": [
      "poison"
    ]
  },
  {
    "id": "monster-arcane-bolt",
    "name": "Arcane Bolt",
    "description": "Fires a bolt of arcane energy at a single target.",
    "icon": "skills/monster/arcane-bolt.png",
    "trigger": "active",
    "target": "single-enemy",
    "cooldown": 2,
    "minLevel": 1,
    "maxLevel": 1,
    "damage": {
      "min": 45,
      "max": 65,
      "breakdown": {
        "arcane": 65
      }
    },
    "damageType": "arcane",
    "appliesTags": [
      "arcane"
    ]
  },
  {
    "id": "monster-rend",
    "name": "Rend",
    "description": "A vicious melee tear that causes the target to bleed.",
    "icon": "skills/monster/rend.png",
    "trigger": "active",
    "target": "single-enemy",
    "cooldown": 2,
    "minLevel": 1,
    "maxLevel": 1,
    "damage": {
      "min": 25,
      "max": 40,
      "breakdown": {
        "physical": 40
      }
    },
    "damageType": "physical",
    "appliesStatus": [
      "bleed"
    ],
    "appliesTags": [
      "physical",
      "bleed"
    ]
  },
  {
    "id": "monster-frozen-orb",
    "name": "Frozen Orb",
    "description": "Hurls a frozen orb that hits all enemies.",
    "icon": "skills/monster/frozen-orb.png",
    "trigger": "active",
    "target": "all-enemies",
    "cooldown": 3,
    "minLevel": 1,
    "maxLevel": 1,
    "damage": {
      "min": 45,
      "max": 65,
      "breakdown": {
        "cold": 65
      }
    },
    "damageType": "cold",
    "appliesStatus": [
      "chill"
    ],
    "appliesTags": [
      "cold",
      "chill"
    ]
  },
  {
    "id": "monster-leap",
    "name": "Leap",
    "description": "Leaps and crashes down on all enemies, stunning briefly.",
    "icon": "skills/monster/leap.png",
    "trigger": "active",
    "target": "all-enemies",
    "cooldown": 4,
    "minLevel": 1,
    "maxLevel": 1,
    "damage": {
      "min": 30,
      "max": 50,
      "breakdown": {
        "physical": 50
      }
    },
    "damageType": "physical",
    "appliesStatus": [
      "stun"
    ],
    "appliesTags": [
      "physical"
    ]
  },
  {
    "id": "monster-enrage",
    "name": "Enrage",
    "description": "Boss enrages, gaining +50% damage for 5 turns.",
    "icon": "skills/monster/enrage.png",
    "trigger": "passive",
    "target": "self",
    "cooldown": 0,
    "minLevel": 1,
    "maxLevel": 1
  },
  {
    "id": "monster-thorns-aura",
    "name": "Thorns Aura",
    "description": "Reflects a portion of melee damage taken back to attackers.",
    "icon": "skills/monster/thorns-aura.png",
    "trigger": "active",
    "target": "all-enemies",
    "cooldown": 1,
    "minLevel": 1,
    "maxLevel": 1,
    "damage": {
      "min": 5,
      "max": 15,
      "breakdown": {
        "thorns": 15
      }
    },
    "damageType": "thorns",
    "appliesTags": [
      "physical"
    ]
  },
  {
    "id": "monster-panic-flee",
    "name": "Panic Flee",
    "description": "The Fallen panics and flees in fear, granting itself extra dodge for a turn.",
    "icon": "skills/monster/panic-flee.png",
    "trigger": "active",
    "target": "self",
    "cooldown": 5,
    "minLevel": 1,
    "maxLevel": 1
  },
  {
    "id": "monster-weak-ranged",
    "name": "Weak Ranged",
    "description": "A weak ranged attack used by trash archers and shooters.",
    "icon": "skills/monster/weak-ranged.png",
    "trigger": "active",
    "target": "single-enemy",
    "cooldown": 1,
    "minLevel": 1,